<?xml version="1.0" encoding="UTF-8"?>
<!-- This XML defines inventory data. -->
<InventoryResponse xmlns:xsi="http://www.w3.org/2001/XMLSchema-instance" xmlns="http://www.ciena.com/XMLSchema/InventoryRetrieval.xsd"
    xsi:schemaLocation="http://www.ciena.com/XMLSchema/InventoryRetrieval.xsd ">
    <!-- Global Settings -->
    <!-- Default setting of runtimeStatus is Critical -->
    <global query="getResourcesWithAttributes" queryString="type=Port" queryResult="Success" />

    <TerminationPoint>
        <PortDetail actorAdminKey="2049" aggProtectionRevertState="0" type="Port" aggProtectionRevertTimer="0"
            operSpeed="5" protectionPort="0" adminFlowCtrlmaxFrameSizemirrorPortmirrorIngressmirrorEgress="null"
            description="to Asd001A_5410_01T 5/1" TrapState="null" name="00:03:18:bc:76:00_Port5/1" adminDuplex="0"
            portState="0" adminSpeed="5" operFlowCtrl="0" aggMode="0" portGlobalTrapStateportPgid="null" operDuplex="0"
            uptime="null" autoNeg="0" portLinkUpDown="null" portname="null" portAdminStatus="1" portOperStatus="2"
            porttype="null" portMacAddress="00:03:18:bf:29:61" displayName="remote.5410-02t.asd001a.dcn.surf.net_Port5/1"
            portId="257" />
    </TerminationPoint>
    <TerminationPoint>
        <PortDetail actorAdminKey="8" aggProtectionRevertState="0" type="Port" aggProtectionRevertTimer="0"
            operSpeed="1" protectionPort="0" adminFlowCtrlmaxFrameSizemirrorPortmirrorIngressmirrorEgress="null"
            description="" TrapState="null" name="00:03:18:bc:76:00_Port1/8" adminDuplex="0" portState="0" adminSpeed="4"
            operFlowCtrl="0" aggMode="0" portGlobalTrapStateportPgid="null" operDuplex="0" uptime="null" autoNeg="0"
            portLinkUpDown="null" portname="null" portAdminStatus="2" portOperStatus="3" porttype="null" portMacAddress="00:03:18:d4:aa:08"
            displayName="remote.5410-02t.asd001a.dcn.surf.net_Port1/8" portId="8" />
    </TerminationPoint>
    <TerminationPoint>
        <PortDetail actorAdminKey="2050" aggProtectionRevertState="0" type="Port" aggProtectionRevertTimer="0"
            operSpeed="1" protectionPort="0" adminFlowCtrlmaxFrameSizemirrorPortmirrorIngressmirrorEgress="null"
            description="" TrapState="null" name="00:03:18:bc:76:00_Port2050" adminDuplex="0" portState="0" adminSpeed="1"
            operFlowCtrl="0" aggMode="0" portGlobalTrapStateportPgid="null" operDuplex="0" uptime="null" autoNeg="0"
            portLinkUpDown="null" portname="null" portAdminStatus="1" portOperStatus="2" porttype="null" portMacAddress="00:03:18:bc:76:09"
            displayName="remote.5410-02t.asd001a.dcn.surf.net_Portto-5410_03T" portId="2050" />
    </TerminationPoint>
    <TerminationPoint>
        <PortDetail actorAdminKey="260" aggProtectionRevertState="0" type="Port" aggProtectionRevertTimer="0"
            operSpeed="5" protectionPort="0" adminFlowCtrlmaxFrameSizemirrorPortmirrorIngressmirrorEgress="null"
            description="to Asd001A_3960_03T 9 (via OMX2T 1611)" TrapState="null" name="00:03:18:bc:76:00_Port5/4"
            adminDuplex="0" portState="0" adminSpeed="5" operFlowCtrl="0" aggMode="0" portGlobalTrapStateportPgid="null"
            operDuplex="0" uptime="null" autoNeg="0" portLinkUpDown="null" portname="null" portAdminStatus="1"
            portOperStatus="2" porttype="null" portMacAddress="00:03:18:bf:29:64" displayName="remote.5410-02t.asd001a.dcn.surf.net_Port5/4"
            portId="260" />
    </TerminationPoint>
    <TerminationPoint>
        <PortDetail actorAdminKey="32" aggProtectionRevertState="0" type="Port" aggProtectionRevertTimer="0"
            operSpeed="1" protectionPort="0" adminFlowCtrlmaxFrameSizemirrorPortmirrorIngressmirrorEgress="null"
            description="" TrapState="null" name="00:03:18:bb:5a:00_Port1/32" adminDuplex="0" portState="0" adminSpeed="4"
            operFlowCtrl="0" aggMode="0" portGlobalTrapStateportPgid="null" operDuplex="0" uptime="null" autoNeg="0"
            portLinkUpDown="null" portname="null" portAdminStatus="2" portOperStatus="3" porttype="null" portMacAddress="00:03:18:d4:ad:e0"
            displayName="remote.5410-03t.asd001a.dcn.surf.net_Port1/32" portId="32" />
    </TerminationPoint>
    <TerminationPoint>
        <PortDetail actorAdminKey="30" aggProtectionRevertState="0" type="Port" aggProtectionRevertTimer="0"
            operSpeed="1" protectionPort="0" adminFlowCtrlmaxFrameSizemirrorPortmirrorIngressmirrorEgress="null"
            description="" TrapState="null" name="00:03:18:bb:5a:00_Port1/30" adminDuplex="0" portState="0" adminSpeed="4"
            operFlowCtrl="0" aggMode="0" portGlobalTrapStateportPgid="null" operDuplex="0" uptime="null" autoNeg="0"
            portLinkUpDown="null" portname="null" portAdminStatus="2" portOperStatus="3" porttype="null" portMacAddress="00:03:18:d4:ad:de"
            displayName="remote.5410-03t.asd001a.dcn.surf.net_Port1/30" portId="30" />
    </TerminationPoint>
    <TerminationPoint>
        <PortDetail actorAdminKey="2050" aggProtectionRevertState="0" type="Port" aggProtectionRevertTimer="0"
            operSpeed="5" protectionPort="0" adminFlowCtrlmaxFrameSizemirrorPortmirrorIngressmirrorEgress="null"
            description="to Asd001A_5410_03T 5/1" TrapState="null" name="00:03:18:bc:76:00_Port5/2" adminDuplex="0"
            portState="0" adminSpeed="5" operFlowCtrl="0" aggMode="0" portGlobalTrapStateportPgid="null" operDuplex="0"
            uptime="null" autoNeg="0" portLinkUpDown="null" portname="null" portAdminStatus="1" portOperStatus="2"
            porttype="null" portMacAddress="00:03:18:bf:29:62" displayName="remote.5410-02t.asd001a.dcn.surf.net_Port5/2"
            portId="258" />
    </TerminationPoint>
    <TerminationPoint>
        <PortDetail actorAdminKey="259" aggProtectionRevertState="0" type="Port" aggProtectionRevertTimer="0"
            operSpeed="5" protectionPort="0" adminFlowCtrlmaxFrameSizemirrorPortmirrorIngressmirrorEgress="null"
            description="to Asd001A_3960_03T 10 (via OMX1T 1611)" TrapState="null" name="00:03:18:bc:76:00_Port5/3"
            adminDuplex="0" portState="0" adminSpeed="5" operFlowCtrl="0" aggMode="0" portGlobalTrapStateportPgid="null"
            operDuplex="0" uptime="null" autoNeg="0" portLinkUpDown="null" portname="null" portAdminStatus="1"
            portOperStatus="2" porttype="null" portMacAddress="00:03:18:bf:29:63" displayName="remote.5410-02t.asd001a.dcn.surf.net_Port5/3"
            portId="259" />
    </TerminationPoint>
    <TerminationPoint>
        <PortDetail actorAdminKey="2" aggProtectionRevertState="0" type="Port" aggProtectionRevertTimer="0"
            operSpeed="4" protectionPort="0" adminFlowCtrlmaxFrameSizemirrorPortmirrorIngressmirrorEgress="null"
            description="to Asd001A_3940_03T 21 (via OMX2T 1471)" TrapState="null" name="00:03:18:bc:76:00_Port1/2"
            adminDuplex="0" portState="0" adminSpeed="4" operFlowCtrl="0" aggMode="0" portGlobalTrapStateportPgid="null"
            operDuplex="0" uptime="null" autoNeg="0" portLinkUpDown="null" portname="null" portAdminStatus="1"
            portOperStatus="2" porttype="null" portMacAddress="00:03:18:d4:aa:02" displayName="remote.5410-02t.asd001a.dcn.surf.net_Port1/2"
            portId="2" />
    </TerminationPoint>
    <TerminationPoint>
        <PortDetail actorAdminKey="4" aggProtectionRevertState="0" type="Port" aggProtectionRevertTimer="0"
            operSpeed="1" protectionPort="0" adminFlowCtrlmaxFrameSizemirrorPortmirrorIngressmirrorEgress="null"
            description="" TrapState="null" name="00:03:18:bc:76:00_Port1/4" adminDuplex="0" portState="0" adminSpeed="4"
            operFlowCtrl="0" aggMode="0" portGlobalTrapStateportPgid="null" operDuplex="0" uptime="null" autoNeg="0"
            portLinkUpDown="null" portname="null" portAdminStatus="1" portOperStatus="3" porttype="null" portMacAddress="00:03:18:d4:aa:04"
            displayName="remote.5410-02t.asd001a.dcn.surf.net_Port1/4" portId="4" />
    </TerminationPoint>
    <TerminationPoint>
        <PortDetail actorAdminKey="3" aggProtectionRevertState="0" type="Port" aggProtectionRevertTimer="0"
            operSpeed="1" protectionPort="0" adminFlowCtrlmaxFrameSizemirrorPortmirrorIngressmirrorEgress="null"
            description="" TrapState="null" name="00:03:18:bc:76:00_Port1/3" adminDuplex="0" portState="0" adminSpeed="4"
            operFlowCtrl="0" aggMode="0" portGlobalTrapStateportPgid="null" operDuplex="0" uptime="null" autoNeg="0"
            portLinkUpDown="null" portname="null" portAdminStatus="1" portOperStatus="3" porttype="null" portMacAddress="00:03:18:d4:aa:03"
            displayName="remote.5410-02t.asd001a.dcn.surf.net_Port1/3" portId="3" />
    </TerminationPoint>
    <TerminationPoint>
        <PortDetail actorAdminKey="260" aggProtectionRevertState="0" type="Port" aggProtectionRevertTimer="0"
            operSpeed="5" protectionPort="0" adminFlowCtrlmaxFrameSizemirrorPortmirrorIngressmirrorEgress="null"
            description="to Asd001A_3960_01T 9" TrapState="null" name="00:03:18:bb:5a:00_Port5/4" adminDuplex="0"
            portState="0" adminSpeed="5" operFlowCtrl="0" aggMode="0" portGlobalTrapStateportPgid="null" operDuplex="0"
            uptime="null" autoNeg="0" portLinkUpDown="null" portname="null" portAdminStatus="1" portOperStatus="2"
            porttype="null" portMacAddress="00:03:18:bf:29:d4" displayName="remote.5410-03t.asd001a.dcn.surf.net_Port5/4"
            portId="260" />
    </TerminationPoint>
    <TerminationPoint>
        <PortDetail actorAdminKey="2050" aggProtectionRevertState="0" type="Port" aggProtectionRevertTimer="0"
            operSpeed="5" protectionPort="0" adminFlowCtrlmaxFrameSizemirrorPortmirrorIngressmirrorEgress="null"
            description="to Asd001A_5410_02T 5/2" TrapState="null" name="00:03:18:bb:5a:00_Port5/1" adminDuplex="0"